rank,fact_type,count,domain,title,url
1,FAKE/HOAX,3,ibtimes.sg,North Korea's first confirmed Coronavirus COVID 19 patient shot dead: report,https://www.ibtimes.sg/north-koreas-first-confirmed-coronavirus-covid-19-patient-shot-dead-report-40042?utm_campaign=/north-koreas-first-confirmed-coronavirus-covid-19-patient-shot-dead-report-40042
2,FAKE/HOAX,2,ibtimes.sg,North Korea's first confirmed Coronavirus COVID 19 patient shot dead: report,https://www.ibtimes.sg/north-koreas-first-confirmed-coronavirus-covid-19-patient-shot-dead-report-40042
3,FAKE/HOAX,1,dailymail.co.uk,Killer coronavirus could be spread through the EYES,https://www.dailymail.co.uk/health/article-7926243/killer-coronavirus-spread-eyes.html?ito=amp_whatsapp_share-top
4,FAKE/HOAX,1,dailymail.co.uk,Shocking footage shows 'medic' in Wuhan crying and screaming,https://www.dailymail.co.uk/news/article-7934751/shocking-footage-shows-medic-wuhan-crying-screaming-anymore.html
5,FAKE/HOAX,1,breitbart.com,Chinese Villages Build Walls to Keep Coronavirus Out,https://www.breitbart.com/asia/2020/01/28/chinese-villages-build-walls-to-keep-coronavirus-out/
6,FAKE/HOAX,1,dailymail.co.uk,Chinese put swastika on Danish flag over coronavirus flag row,https://www.dailymail.co.uk/news/article-7948913/chinese-swastika-danish-flag-pm-refuses-apologise-coronavirus-china-flag.html
7,CONSPIRACY/JUNKSCI,1,truepundit.com,North Korea's First Confirmed Coronavirus Patient Shot Dead – True Pundit,https://truepundit.com/north-koreas-first-confirmed-coronavirus-patient-shot-dead/
