rank,fact_type,count,domain,title,url
1,FAKE/HOAX,1,bigleaguepolitics.com,HMM: Coronavirus Patent is Owned by Vaccine-Production Institute Funded by Bill Gates - Big League Politics,https://bigleaguepolitics.com/hmm-coronavirus-patent-is-owned-by-vaccine-production-institute-funded-by-bill-gates/
2,FAKE/HOAX,1,strategic-culture.org,"Who Made Coronavirus? Was It the U.S., Israel or China Itself?",https://www.strategic-culture.org/news/2020/03/05/who-made-coronavirus-was-it-us-israel-or-china-itself/
3,FAKE/HOAX,1,n.news.naver.com,김재중 “코로나19 확진→만우절 농담”…도넘은 장난,https://n.news.naver.com/entertain/now/article/018/0004610638
4,FAKE/HOAX,1,dailymail.co.uk,China will treat coronavirus with bear bile and goat horn injections,https://www.dailymail.co.uk/news/article-8179287/china-treat-coronavirus-patients-injections-bear-bile-goat-horn.html?ito=facebook_share_fbia-top&fbclid=iwar2hbbpvjb7kapfvvvkjwak--uvv2dlpramytksozbjtyqolro2r4f2ift0
5,FAKE/HOAX,1,dailymail.co.uk,Third Russian doctor plunges from coronavirus hospital window,https://www.dailymail.co.uk/news/article-8282033/third-russian-doctor-plunges-coronavirus-hospital-window.html
6,CONSPIRACY/JUNKSCI,1,activistpost.com,,https://www.activistpost.com/2019/11/anonymous-hacks-china-as-chinese-military-moves-on-hong-kong-students-trapped-at-polytechnic-university.html
